Sentence,Source
"An additional challenge lies in harmonizing cognitive and clinical measures. Although the 
introduction of International Common Data Elements for TBI has facilitated use of 
recommended measures within a variety of outcome domains, considerable variability still 
exists as appropriate measures differ between populations of interest (e.g., athletes vs 
military), age range (measures developed and normed for young children differ from those 
used in older children or adults), acuity (symptoms and outcome for acute vary from those in 
chronic phases of recovery) and severity (outcome domains and measures most relevant for 
concussion differ from those used in more severe TBI). Although neuropsychological testing 
or other outcome assessment is common in many studies, the specific assessments used 
necessarily vary widely. Several options exist for harmonizing these data or developing 
common comparable cognitive endpoints that could be used to further the research. The 
most conservative approach involves identification of the most commonly used scales across 
studies and focus analyses around domains and cohorts where common data was collected. 
Another approach would be to convert scores within a given outcome domain to 
standardized T-scores based on population means and standard deviations. This allows for 
more variability in the specific measures that can be included, but care must be applied in 
ensuring that the cognitive constructs are indeed consistent. A third approach involves 
calculating a cognitive composition score created by assigning weighted scores based on the 
degree to which an individual test score deviates from normative expectations (increased 
deviation, increased weight). This method is expected to improve sensitivity by creating 
finer gradations across patients and increase the ceiling for improved detection even in 
mTBI ( Silverberg et al. 2017 ). Finally, in addition to working together to harmonize existing 
outcome data and to address novel imaging analytic pipelines, the development, testing, and 
optimization of innovative cognitive and neurobehavioral outcome measures that are specific 
to the assessment of mTBI, concussion, and repetitive head hits may be a goal of the 
working groups, where appropriate.
Though not discussed directly in this special issue, the recently established Cognitive 
Endpoints group has begun piloting additional statistical methods that are intended to 
quantify the disparity in cognitive measures administered between cohorts. Once the 
disparity is known, the goal would be to apply a set of flexible statistical methods designed 
to minimize the disparity (i.e., item response theory, machine learning) in measures 
administered to produce a set of co-calibrated and validated measures that can be used in 
analyses with the harmonized imaging data. Following these steps (see Figure 3), seemingly 
disparate cognitive data acquired independently across cohorts can move from a low value 
state with regards to big data approaches toward a more useful high value set of variables 
that can examined in an aggregated manner. Data curated and processed in this manner will 
be especially critical when defining the relevant brain-behavior relationships or identifying 
any unique behavioral phenotypes that exist across or within TBI cohorts. In addition, this 
promising effort could be applied more broadly to other ENIGMA working data to allow for 
the exploration of behavioral/functional relationships between imaging findings and these 
common cognitive endpoints.
The use of fluid biomarkers and genetics also brings challenges. As with imaging, important 
considerations surround differences in the collection, processing, and analysis of biofluid 
samples that will necessarily vary by site. An optimal approach includes the use of Wilde et al. Page 8
Brain Imaging Behav . Author manuscript; available in PMC 2022 April 01.
Author Manuscript Author Manuscript Author Manuscript Author Manuscript",nihms-1672220.pdf
"standardized procedures on the actual samples using a limited number of “batches”, but 
meta-analyses are also possible with these data ( Berger et al. 2012 ; Manley et al. 2010 ).
While advances in technology have supported the growing movement towards data sharing 
and open science, there are important legal, ethical, and regulatory issues with global data 
sharing ( Palk et al. 2019 ). All of these considerations are aimed at protecting participant 
privacy and controlling data use. Anonymization is often required, although what is 
considered “anonymized” differs ( Sariyar et al. 2015 ), and this can include both meta-data in 
a file header and physical features from MR images ( Milchenko and Marcus 2013 ). While 
some institutions and countries allow for data sharing to be considered under a “broad 
consent”, others require explicit statements regarding future potential uses of individual data. 
The recently enacted General Data Protection Regulation (GDPR) imposed restrictions on 
sharing personal data within and outside the European Union and requires explicit consent 
from an individual to share data outside of a few lawful purposes ( V oigt and V on dem 
Bussche 2017 ). Material Transfer Agreements (MTAs) and Data Use Agreements (DUAs) 
are required by some institutions, and may be applied more stringently in certain populations 
(e.g., U.S. Veterans and Active Duty Service Members, children, etc.). A Uniform 
Biological Material Transfer Agreement (UBMTA) can expedite transfer between 
participating universities ( Carr et al. 2017 ). Sharing genomic data brings additional 
concerns, as release of this information could have broad legal, medical, and other 
consequences for the individual. The NIH mandates that genomic data be submitted to 
dbGaP (database of Genotypes and Phenotypes) after identifying information is removed 
(names, dates, locations)( Paltoo et al. 2014 ). Controlled access to genomic data is then 
granted to researchers for a specific project. Sharing summary level data within ENIGMA, 
as opposed to raw imaging data, addresses many of these concerns, although some 
institutions restrict this level of sharing as well. In these cases, scripts for site-level statistical 
analysis can be shared with summary statistics returned to the primary site. COINSTAC 
(Collaborative Informatics and Neuroimaging Suite Toolkit for Anonymous Computation) is 
web-based framework for executing harmonized processing and analysis across multiple 
sites that allows the data to stay local, negating the need for explicit sharing consent or 
MTA/DUAs ( Plis et al. 2016 ). Encouragingly, other consortia have reported that 
harmonization was more of a challenge than permissions ( Budin-Ljøsne et al. 2014 ). The 
activities of ENIGMA over the last decade have shown that while there are numerous 
hurdles to data-sharing and international collaboration, in most cases there are solutions that 
satisfy the ethical and legal requirements while facilitating group science ( Thompson et al. 
2020 ). ENIGMA is active in efforts to enhance understanding of regulations in several 
regions of the world around data sharing, and to formulate solutions to facilitate global 
collaboration.
Progress and Deliverables
We will continuously assess our progress to ensure that ENIGMA Brain Injury is moving the 
field forward and supporting the researchers involved. Our immediate goals are to establish 
and expand our network of interested researchers along with potential new datasets to 
include, and identify funding mechanisms to support the effort. Intermediate goals include 
developing and testing new pipelines for processing neuroimaging data that consider Wilde et al. Page 9
Brain Imaging Behav . Author manuscript; available in PMC 2022 April 01.
Author Manuscript Author Manuscript Author Manuscript Author Manuscript",nihms-1672220.pdf
"structural deformations, improve classification of neuropathology such as white matter 
hyperintensities, allow for longitudinal modeling of change after injury, and are stable and 
useful across sites. Continuous goals include supporting the advancement of junior 
investigators through the opportunity to propose and lead new analyses and to provide a 
forum for researchers to discuss controversies and open questions in the field. In the long-
term, we hope that this effort will yield hypotheses that researchers can interrogate in greater 
depth in their individual cohorts and lead to new collaborations among participants as they 
plan future studies with a goal of improving comparability in a mutually beneficial manner. 
The deliverables for the ENIGMA Brain Injury group include publications, grants, new 
pipeline development, establishment of best practices for combining data and for processing 
TBI neuroimaging data (particularly with regard to lesions), and datasets that have been 
curated and harmonized. The ENIGMA Brain Injury group has quarterly conference calls 
along with regular in-person meetings coinciding with relevant conferences to inform 
collaborators of progress and make plans moving forward. Each subgroup has monthly or bi-
monthly conference calls to discuss specific analyses.
Conclusions
The ENIGMA Brain Injury group aims to bring together researchers from around the world 
with the shared goal of furthering our understanding of the impact of brain injury and factors 
that may influence outcome. Building off of the framework of the extremely productive 
broader ENIGMA consortium, we are optimistic that this effort will yield new information 
and will help answer open questions in the field. We also expect our research to introduce 
new questions and hypotheses that individual cohorts can investigate in greater detail and 
will hopefully inspire new data collection. In contrast to other efforts, raw data are not 
centralized, and contributing sites maintain ownership and control of their data, with all 
analyses being opt-in. All members are welcome to submit secondary proposals, benefitting 
from an expanded collaborative network and larger sample size. Researchers interested in 
joining or learning more about the ENIGMA Brain Injury group are encouraged to read the 
companion articles in this special issue and contact the authors.
Acknowledgements
We acknowledge funding sources including K99 NS096116 to Dr. Dennis and PT12051 and I01 RX002174 
(CENC) to Drs. Wilde, Tate, and Dennis. The authors wish to acknowledge the leadership of Dr. Paul Thompson 
(ENIGMA PI) as well as the leadership of Drs. Frank Hillary, Alexander Olsen, Inga Koerte, David Baron, 
Alexander Lin, Brenda Bartnik-Olson, Karen Caeyenberghs, Carrie Esopenko, and Neda Jahanshad, as well as 
ENIGMA support personnel and all working group members and contributors. We wish to acknowledge the 
contribution of Eamonn Kennedy in the conceptualization and creation of the figures. We also wish to thank all 
participants who have contributed to this research. Finally, we extend our gratitude to Drs. Erin D. Bigler and 
Martha E. Shenton for their thoughtful review of this manuscript and their enduring mentorship and support.
References
Adhikari BM, Jahanshad N, Shukla D, Glahn DC, Blangero J, Reynolds RC, et al. (2018). Heritability 
estimates on resting state fMRI data using ENIGMA analysis pipeline. Pacific Symposium on 
Biocomputing. Pacific Symposium on Biocomputing, 23, 307–318. [PubMed: 29218892] 
Adhikari BM, Jahanshad N, Shukla D, Turner J, Grotegerd D, Dannlowski U, et al. (2018). A resting 
state fMRI analysis pipeline for pooling inference across diverse cohorts: an ENIGMA rs-fMRI 
protocol. Brain imaging and behavior. doi:10.1007/s11682-018-9941-xWilde et al. Page 10
Brain Imaging Behav . Author manuscript; available in PMC 2022 April 01.
Author Manuscript Author Manuscript Author Manuscript Author Manuscript",nihms-1672220.pdf
"Bartnik-Olson B, Alger J, Babikian T, Harris AD, Holshouser B, Kirov II, et al. (2020). The Clinical 
Utility of Magnetic Resonance Spectroscopy in Traumatic Brain Injury: Recommendations from the 
ENIGMA MRS Working Group. Brain imaging and behavior, In Press (Special Issue).
Berger RP, Beers SR, Papa L, Bell M, & Pediatric TBI CDE Biospecimens and Biomarkers 
Workgroup. (2012). Common data elements for pediatric traumatic brain injury: recommendations 
from the biospecimens and biomarkers workgroup. Journal of neurotrauma, 29(4), 672–677. 
[PubMed: 22106839] 
Broglio SP, McCrea M, McAllister T, Harezlak J, Katz B, Hack D, et al. (2017). A National study on 
the effects of concussion in collegiate athletes and US military service academy members: the 
NCAA--DoD concussion assessment, research and education (CARE) consortium structure and 
methods. Sports medicine, 47(7), 1437–1451. [PubMed: 28281095] 
Budin-Ljøsne I, Isaeva J, Knoppers BM, Tassé AM, Shen H-Y , McCarthy MI, et al. (2014). Data 
sharing in large research consortia: experiences and recommendations from ENGAGE. European 
journal of human genetics: EJHG, 22(3), 317–321. [PubMed: 23778872] 
Carr N, Shin I, & Maier S (2017, 3 1). Material Transfer and Data Use Agreements. Journal of Clinical 
Research Best Practices. https://papers.ssrn.com/abstract=3195015 . Accessed 11 September 2019
Cetin Karayumak S, Bouix S, Ning L, James A, Crow T, Shenton M, et al. (2019). Retrospective 
harmonization of multi-site diffusion MRI data acquired with different acquisition parameters. 
NeuroImage, 184, 180–200. [PubMed: 30205206] 
Cetin-Karayumak S, Di Biase MA, Chunga N, Reid B, Somes N, Lyall AE, et al. (2019). White matter 
abnormalities across the lifespan of schizophrenia: a harmonized multi-site diffusion MRI study. 
Molecular psychiatry. doi:10.1038/s41380-019-0509-y
Dennis EL, Caeyenberghs K, Asarnow RF, Babikian T, Bartnik-Olson B, Bigler ED, et al. (2020). 
Brain Imaging in Young Brain-Injured Patients: A Coordinated Effort Towards Individualized 
Predictors from the ENIGMA Pediatric msTBI Group. Brain imaging and behavior, In Press 
(Special Issue).
Dennis EL, Disner SG, Fani N, Salminen LE, Logue M, Clarke EK, et al. (2019, 6 20). Altered White 
Matter Microstructural Organization in Post-Traumatic Stress Disorder across 3,049 Adults: 
Results from the PGC-ENIGMA PTSD Consortium. bioRxiv. doi:10.1101/677153
Duncan D, Barisano G, Cabeen R, Sepehrband F, Garner R, Braimah A, et al. (2018). Analytic Tools 
for Post-traumatic Epileptogenesis Biomarker Search in Multimodal Dataset of an Animal Model 
and Human Patients. Frontiers in neuroinformatics, 12, 86. [PubMed: 30618695] 
Esopenko C, Meyer J, Wilde EA, Marshall A, Tate DF, Lin A, et al. (2020). Harmonization of 
Measures to Assess IPV-Related Head Trauma: Recommendations from the ENIGMA IPV 
Working Group. Brain imaging and behavior, In Press (Special Issue).
Frodl T, Janowitz D, Schmaal L, Tozzi L, Dobrowolny H, Stein DJ, et al. (2017). Childhood adversity 
impacts on brain subcortical structures relevant to depression. Journal of psychiatric research, 86, 
58–65. [PubMed: 27918926] 
Gorgolewski KJ, Auer T, Calhoun VD, Craddock RC, Das S, Duff EP, et al. (2016). The brain imaging 
data structure, a format for organizing and describing outputs of neuroimaging experiments. 
Scientific data, 3, 160044. [PubMed: 27326542] 
Johnson WE, Li C, & Rabinovic A (2007). Adjusting batch effects in microarray expression data using 
empirical Bayes methods. Biostatistics, 8(1), 118–127. [PubMed: 16632515] 
Kelly S, van Velzen L, Veltman D, Thompson P, Jahanshad N, Schmaal L, & Group, Group. (2017). 
941. White Matter Microstructural Differences in Major Depression: Meta-Analytic Findings from 
Enigma-MDD DTI. Biological psychiatry, 81(10), S381.
Koerte IK, Dennis EL, Bazarian JJ, Bigler ED, Buckley T, Choe M, et al. (2020). Neuroimaging of 
Sport-Related Brain Injury: Challenges and Recommendations from the ENIGMA Sports-Related 
Brain Injury group. Brain imaging and behavior, In Press (Special Issue).
Kremen WS, Franz CE, & Lyons MJ (2013). VETSA: the Vietnam Era Twin Study of Aging. Twin 
research and human genetics: the official journal of the International Society for Twin Studies, 
16(1), 399–402. [PubMed: 23110957] 
Lepage C, de Pierrefeu A, Koerte IK, Coleman MJ, Pasternak O, Grant G, et al. (2018). White matter 
abnormalities in mild traumatic brain injury with and without post-traumatic stress disorder: a Wilde et al. Page 11
Brain Imaging Behav . Author manuscript; available in PMC 2022 April 01.
Author Manuscript Author Manuscript Author Manuscript Author Manuscript",nihms-1672220.pdf
"subject-specific diffusion tensor imaging study. Brain imaging and behavior, 12(3), 870–881. 
[PubMed: 28676987] 
Logue MW, van Rooij SJH, Dennis EL, Davis SL, Hayes JP, Stevens JS, et al. (2017). Smaller 
hippocampal volume in posttraumatic stress disorder: a multi-site ENIGMA-PGC study. 
Biological psychiatry.
Maas AIR, Menon DK, Steyerberg EW, Citerio G, Lecky F, Manley GT, et al. (2015). Collaborative 
European NeuroTrauma Effectiveness Research in Traumatic Brain Injury (CENTER-TBI): a 
prospective longitudinal observational study. Neurosurgery, 76(1), 67–80. [PubMed: 25525693] 
Mackey S, Allgaier N, Chaarani B, Spechler P, Orr C, Bunn J, et al. (2019). Mega-Analysis of Gray 
Matter V olume in Substance Dependence: General and Substance-Specific Regional Effects. The 
American journal of psychiatry, 176(2), 119–128. [PubMed: 30336705] 
Manley GT, Diaz-Arrastia R, Brophy M, Engel D, Goodman C, Gwinn K, et al. (2010). Common data 
elements for traumatic brain injury: recommendations from the biospecimens and biomarkers 
working group. Archives of physical medicine and rehabilitation, 91(11), 1667–1672. [PubMed: 
21044710] 
Milchenko M, & Marcus D (2013). Obscuring surface anatomy in volumetric imaging data. 
Neuroinformatics, 11(1), 65–75. [PubMed: 22968671] 
Olsen A, Babikian T, Bigler E, Caeyenberghs K, Conde V , Dams-O’Connor K, et al. (2020). Toward a 
Global and Open Science for Imaging Brain Trauma: the ENIGMA Adult msTBI Working Group. 
Brain imaging and behavior, In Press (Special Issue).
Palk A, Illes J, Thompson PM, & Stein DJ (2019). Ethical Issues in Global Imaging Genetics 
Collaborations. NeuroImage, In Review.
Paltoo DN, Rodriguez LL, Feolo M, Gillanders E, Ramos EM, Rutter JL, et al. (2014). Data use under 
the NIH GWAS data sharing policy and future directions. Nature genetics, 46(9), 934–938. 
[PubMed: 25162809] 
Plis SM, Sarwate AD, Wood D, Dieringer C, Landis D, Reed C, et al. (2016). COINSTAC: A Privacy 
Enabled Model and Prototype for Leveraging and Processing Decentralized Brain Imaging Data. 
Frontiers in Neuroscience. doi:10.3389/fnins.2016.00365
Putukian M, D’Alonzo BA, Campbell-McGovern CS, & Wiebe DJ (2019). The Ivy League-Big Ten 
Epidemiology of Concussion Study: A Report on Methods and First Findings. The American 
journal of sports medicine, 47(5), 1236–1247. [PubMed: 30943078] 
Rentería ME, Schmaal L, Hibar DP, Couvy-Duchesne B, Strike LT, Mills NT, et al. (2017). Subcortical 
brain structure and suicidal behaviour in major depressive disorder: a meta-analysis from the 
ENIGMA-MDD working group. Translational psychiatry, 7(5), e1116. [PubMed: 28463239] 
Sariyar M, Schluender I, Smee C, & Suhr S (2015). Sharing and Reuse of Sensitive Data and Samples: 
Supporting Researchers in Identifying Ethical and Legal Requirements. Biopreservation and 
biobanking, 13(4), 263–270. [PubMed: 26186169] 
Schmaal L, Hibar DP, Sämann PG, Hall GB, Baune BT, Jahanshad N, et al. (2017). Cortical 
abnormalities in adults and adolescents with major depression based on brain scans from 20 
cohorts worldwide in the ENIGMA Major Depressive Disorder Working Group. Molecular 
psychiatry, 22(6), 900–909. [PubMed: 27137745] 
Schmaal L, Veltman DJ, van Erp TGM, Sämann PG, Frodl T, Jahanshad N, et al. (2016). Subcortical 
brain alterations in major depressive disorder: findings from the ENIGMA Major Depressive 
Disorder working group. Molecular psychiatry, 21(6), 806–812. [PubMed: 26122586] 
Silverberg ND, Crane PK, Dams-O’Connor K, Holdnack J, Ivins BJ, Lange RT, et al. (2017). 
Developing a Cognition Endpoint for Traumatic Brain Injury Clinical Trials. Journal of 
neurotrauma, 34(2), 363–371. [PubMed: 27188248] 
Tate DF, Dennis EL, Adams JT, Adamson MM, Belanger HG, Bigler ED, et al. (2020). Coordinating 
Global Multi-Site Studies of Military TBI: Potential, Challenges, and Harmonization Guidelines 
from the ENIGMA Military Brain Injury Group. Brain imaging and behavior, In Press (Special 
Issue).
Thompson P, Jahanshad N, Ching CRK, Salminen L, Thomopoulos SI, Bright J, et al. (2020). 
ENIGMA and Global Neuroscience: A Decade of Large-Scale Studies of the Brain in Health and Wilde et al. Page 12
Brain Imaging Behav . Author manuscript; available in PMC 2022 April 01.
Author Manuscript Author Manuscript Author Manuscript Author Manuscript",nihms-1672220.pdf
"Disease across more than 40 Countries. Translational Psychiatry, 10(1), 1–28 [PubMed: 
32066695] 
Tozzi L, Garczarek L, Janowitz D, Stein DJ, Wittfeld K, Dobrowolny H, et al. (2019). Interactive 
impact of childhood maltreatment, depression, and age on cortical brain structure: mega-analytic 
findings from a large multi-site cohort. Psychological medicine, 1–12.
Veer I, Waller L, Lett T, Erk S, & Walter H (2019). ENIGMA task-based fMRI: A workgroup studying 
the genetic basis of task-evoked brain activity. Presented at the Organization for Human Brain 
Mapping.
V oigt P, & V on dem Bussche A (2017). The eu general data protection regulation (gdpr). A Practical 
Guide, 1st Ed., Cham: Springer International Publishing. https://link.springer.com/content/pdf/
10.1007/978-3-319-57959-7.pdf
Walker WC, Carne W, Franke LM, Nolen T, Dikmen SD, Cifu DX, et al. (2016). The Chronic Effects 
of Neurotrauma Consortium (CENC) multi-centre observational study: Description of study and 
characteristics of early participants. Brain injury: [BI], 30(12), 1469–1480.
Weiner MW, Veitch DP, Hayes J, Neylan T, Grafman J, Aisen PS, et al. (2014). Effects of traumatic 
brain injury and posttraumatic stress disorder on Alzheimer’s disease in veterans, using the 
Alzheimer's Disease Neuroimaging Initiative. Alzheimer’s & dementia: the journal of the 
Alzheimer's Association, 10(3 Suppl), S226–35.
Yue JK, Vassar MJ, Lingsma HF, Cooper SR, Okonkwo DO, Valadka AB, et al. (2013). Transforming 
research and clinical knowledge in traumatic brain injury pilot: multicenter implementation of the 
common data elements for traumatic brain injury. Journal of neurotrauma, 30(22), 1831–1844. 
[PubMed: 23815563] Wilde et al. Page 13
Brain Imaging Behav . Author manuscript; available in PMC 2022 April 01.
Author Manuscript Author Manuscript Author Manuscript Author Manuscript",nihms-1672220.pdf
"Figure 1. 
Organization of the ENIGMA consortium and the ENIGMA Brain Injury working group. 
Map in top right shows current sites across ENIGMA, map in bottom right shows current 
sites in the ENIGMA Brain Injury working group. TBI=traumatic brain injury, 
dMRI=diffusion magnetic resonance spectroscopy, EEG=electroencephalography, 
rsfMRI=resting state functional MRI, tbfMRI=task based fMRI, GWAS=genome-wide 
association study, CNV=copy number variation, MDD=major depressive disorder, 
AD=anxiety disorder, PTSD=post-traumatic stress disorder, FTD=frontotemporal dementia, 
HIV=human immunodeficiency virus, OCD=obsessive compulsive disorder, 
ADHD=attention-deficit/hyperactivity disorder, 22q DS=22q11.2 deletion syndrome. 
Adapted from Thompson et al., 2020 .Wilde et al. Page 14
Brain Imaging Behav . Author manuscript; available in PMC 2022 April 01.
Author Manuscript Author Manuscript Author Manuscript Author Manuscript",nihms-1672220.pdf
"Figure 2. 
Schematic showing the approach and goals of the ENIGMA Brain Injury working group.Wilde et al. Page 15
Brain Imaging Behav . Author manuscript; available in PMC 2022 April 01.
Author Manuscript Author Manuscript Author Manuscript Author Manuscript",nihms-1672220.pdf
"Figure 3. 
This illustration shows several steps in producing common cognitive endpoints using data 
from different sources/cohorts. The first column shows a theoretical set of data from a 
variety of sources with unknown disparity, for which the value of the data in aggregated 
form is unknown. When data is collated from these various sources, the disparity can be 
quantified and constructs emerge. Based on the degree of disparity, different statistical 
methods for harmonizing the constructs can be applied to minimize disparity. Finally, these 
constructs can be refactored into data that would allow investigators to perform comparisons 
across these datasets, thereby improving the value and extending the usability of the data in 
big data analyses.Wilde et al. Page 16
Brain Imaging Behav . Author manuscript; available in PMC 2022 April 01.
Author Manuscript Author Manuscript Author Manuscript Author Manuscript",nihms-1672220.pdf
